aiter/ops/triton/configs/MI350X-FUSED-GEMM-A16W16-2O-N=8-K=15360.json
{
  "M_LEQ_32": {
    "BLOCK_SIZE_M": 16,
    "BLOCK_SIZE_N": 2,
    "BLOCK_SIZE_K": 512,
    "GROUP_SIZE_M": 1,
    "num_warps": 4,
    "num_stages": 1,
    "waves_per_eu": 4,
    "matrix_instr_nonkdim": 16,
    "cache_modifier": null,
    "NUM_KSPLIT": 8
  },
  "M_LEQ_128": {
    "BLOCK_SIZE_M": 8,
    "BLOCK_SIZE_N": 4,
    "BLOCK_SIZE_K": 512,
    "GROUP_SIZE_M": 1,
    "num_warps": 2,
    "num_stages": 1,
    "waves_per_eu": 1,
    "matrix_instr_nonkdim": 16,
    "cache_modifier": null,
    "NUM_KSPLIT": 8
  },
  "any": {
    "BLOCK_SIZE_M": 8,
    "BLOCK_SIZE_N": 4,
    "BLOCK_SIZE_K": 512,
    "GROUP_SIZE_M": 1,
    "num_warps": 2,
    "num_stages": 1,
    "waves_per_eu": 1,
    "matrix_instr_nonkdim": 16,
    "cache_modifier": null,
    "NUM_KSPLIT": 8
  }
}